{
  "schema_version": "1.0",
  "id": "decision-ntt-010-ambiguous",
  "domain": "change",
  "outcome": "INSUFFICIENT_EVIDENCE",
  "gate_action": "advise",
  "confidence": "low",
  "reason_code": "GOLDEN_NTT_010_AMBIGUOUS",
  "summary": "Golden ambiguous outcome for NTT-010.",
  "rationale": "Exposure is unknown; return candidate with uncertainty. Rule contract: Do not generate edge cases with no plausible likelihood or impact.",
  "remediation": null,
  "obligation_candidate_ids": [],
  "evidence_ids": [
    "evidence-ntt-010-ambiguous"
  ],
  "target": {
    "scope": null,
    "purpose": null,
    "technique": null,
    "cadence": null,
    "failure_class": null,
    "test_path": null
  },
  "cleanup_requirements": null,
  "limitations": [
    "Emit advisory or INSUFFICIENT_EVIDENCE; never gate."
  ]
}
