{
  "schema_version": "1.0",
  "id": "decision-tst-006-ambiguous",
  "domain": "change",
  "outcome": "INSUFFICIENT_EVIDENCE",
  "gate_action": "advise",
  "confidence": "low",
  "reason_code": "GOLDEN_TST_006_AMBIGUOUS",
  "summary": "Golden ambiguous outcome for TST-006.",
  "rationale": "A workflow appears critical from naming but is not declared; advise declaration rather than gate. Rule contract: Maintain a small number of system-level checks for explicitly critical user or operator journeys.",
  "remediation": null,
  "obligation_candidate_ids": [],
  "evidence_ids": [
    "evidence-tst-006-ambiguous"
  ],
  "target": {
    "scope": null,
    "purpose": null,
    "technique": null,
    "cadence": null,
    "failure_class": null,
    "test_path": null
  },
  "cleanup_requirements": null,
  "limitations": [
    "Emit advisory or INSUFFICIENT_EVIDENCE; never gate."
  ]
}
