{
  "schema_version": "1.0",
  "id": "decision-ntt-006-positive",
  "domain": "change",
  "outcome": "NO_TEST_SUPPORTED",
  "gate_action": "allow",
  "confidence": "high",
  "reason_code": "GOLDEN_NTT_006_POSITIVE",
  "summary": "Golden positive outcome for NTT-006.",
  "rationale": "Test adds an impossible branch case to raise coverage. Rule contract: Do not add cases solely to execute every syntactic branch.",
  "remediation": null,
  "obligation_candidate_ids": [
    "obligation-ntt-006-positive"
  ],
  "evidence_ids": [
    "evidence-ntt-006-positive"
  ],
  "target": {
    "scope": null,
    "purpose": null,
    "technique": null,
    "cadence": null,
    "failure_class": null,
    "test_path": null
  },
  "cleanup_requirements": null,
  "limitations": []
}
