{
  "schema_version": "1.0",
  "id": "decision-tst-007-ambiguous",
  "domain": "change",
  "outcome": "INSUFFICIENT_EVIDENCE",
  "gate_action": "advise",
  "confidence": "low",
  "reason_code": "GOLDEN_TST_007_AMBIGUOUS",
  "summary": "Golden ambiguous outcome for TST-007.",
  "rationale": "A comment claims compliance significance without a maintained policy; mark inferred and advisory. Rule contract: Use specialized evidence for security, privacy, accessibility, latency, resilience, recovery, and compliance at the observable scope.",
  "remediation": null,
  "obligation_candidate_ids": [],
  "evidence_ids": [
    "evidence-tst-007-ambiguous"
  ],
  "target": {
    "scope": null,
    "purpose": null,
    "technique": null,
    "cadence": null,
    "failure_class": null,
    "test_path": null
  },
  "cleanup_requirements": null,
  "limitations": [
    "Emit advisory or INSUFFICIENT_EVIDENCE; never gate."
  ]
}
