{
  "schema_version": "1.0",
  "id": "decision-tst-005-ambiguous",
  "domain": "change",
  "outcome": "INSUFFICIENT_EVIDENCE",
  "gate_action": "advise",
  "confidence": "low",
  "reason_code": "GOLDEN_TST_005_AMBIGUOUS",
  "summary": "Golden ambiguous outcome for TST-005.",
  "rationale": "An exported TypeScript type changes but runtime consumers are unknown; report a derived contract candidate. Rule contract: Protect consumer/provider contracts, schemas, formats, migrations, and version windows.",
  "remediation": null,
  "obligation_candidate_ids": [],
  "evidence_ids": [
    "evidence-tst-005-ambiguous"
  ],
  "target": {
    "scope": null,
    "purpose": null,
    "technique": null,
    "cadence": null,
    "failure_class": null,
    "test_path": null
  },
  "cleanup_requirements": null,
  "limitations": [
    "Emit advisory or INSUFFICIENT_EVIDENCE; never gate."
  ]
}
