{
  "schema_version": "1.0",
  "id": "decision-chg-005-ambiguous",
  "domain": "change",
  "outcome": "INSUFFICIENT_EVIDENCE",
  "gate_action": "advise",
  "confidence": "low",
  "reason_code": "GOLDEN_CHG_005_AMBIGUOUS",
  "summary": "Golden ambiguous outcome for CHG-005.",
  "rationale": "Bug report lacks a minimal reproduction. Rule contract: Find why evidence missed the bug and add one guard for that failure class only when needed.",
  "remediation": null,
  "obligation_candidate_ids": [],
  "evidence_ids": [
    "evidence-chg-005-ambiguous"
  ],
  "target": {
    "scope": null,
    "purpose": null,
    "technique": null,
    "cadence": null,
    "failure_class": null,
    "test_path": null
  },
  "cleanup_requirements": null,
  "limitations": [
    "Emit advisory or INSUFFICIENT_EVIDENCE; never gate."
  ]
}
