{
  "schema_version": "1.0",
  "id": "decision-chg-006-ambiguous",
  "domain": "change",
  "outcome": "INSUFFICIENT_EVIDENCE",
  "gate_action": "advise",
  "confidence": "low",
  "reason_code": "GOLDEN_CHG_006_AMBIGUOUS",
  "summary": "Golden ambiguous outcome for CHG-006.",
  "rationale": "Dependency upgrade changelog is unavailable and behavior impact is unknown. Rule contract: Test at the real boundary or contract; mocks serve fault injection or rare states, not wiring proof.",
  "remediation": null,
  "obligation_candidate_ids": [],
  "evidence_ids": [
    "evidence-chg-006-ambiguous"
  ],
  "target": {
    "scope": null,
    "purpose": null,
    "technique": null,
    "cadence": null,
    "failure_class": null,
    "test_path": null
  },
  "cleanup_requirements": null,
  "limitations": [
    "Emit advisory or INSUFFICIENT_EVIDENCE; never gate."
  ]
}
