{
  "schema_version": "1.0",
  "id": "decision-ntt-001-positive",
  "domain": "change",
  "outcome": "NO_TEST_SUPPORTED",
  "gate_action": "allow",
  "confidence": "high",
  "reason_code": "GOLDEN_NTT_001_POSITIVE",
  "summary": "Golden positive outcome for NTT-001.",
  "rationale": "A test merely proves Array.sort sorts. Rule contract: Do not test framework, language, ORM, serializer, client, or standard-library behavior the repository does not customize.",
  "remediation": null,
  "obligation_candidate_ids": [
    "obligation-ntt-001-positive"
  ],
  "evidence_ids": [
    "evidence-ntt-001-positive"
  ],
  "target": {
    "scope": null,
    "purpose": null,
    "technique": null,
    "cadence": null,
    "failure_class": null,
    "test_path": null
  },
  "cleanup_requirements": null,
  "limitations": []
}
