{
  "schema_version": "1.0",
  "id": "decision-chg-011-ambiguous",
  "domain": "change",
  "outcome": "INSUFFICIENT_EVIDENCE",
  "gate_action": "advise",
  "confidence": "low",
  "reason_code": "GOLDEN_CHG_011_AMBIGUOUS",
  "summary": "Golden ambiguous outcome for CHG-011.",
  "rationale": "Configuration may be inert in current environment; deployment mapping absent. Rule contract: Use validation, smoke, and production-like wiring evidence rather than source-level unit tests.",
  "remediation": null,
  "obligation_candidate_ids": [],
  "evidence_ids": [
    "evidence-chg-011-ambiguous"
  ],
  "target": {
    "scope": null,
    "purpose": null,
    "technique": null,
    "cadence": null,
    "failure_class": null,
    "test_path": null
  },
  "cleanup_requirements": null,
  "limitations": [
    "Emit advisory or INSUFFICIENT_EVIDENCE; never gate."
  ]
}
