{
  "schema_version": "1.0",
  "id": "decision-chg-004-ambiguous",
  "domain": "change",
  "outcome": "INSUFFICIENT_EVIDENCE",
  "gate_action": "advise",
  "confidence": "low",
  "reason_code": "GOLDEN_CHG_004_AMBIGUOUS",
  "summary": "Golden ambiguous outcome for CHG-004.",
  "rationale": "Function includes hidden I/O despite pure-looking signature. Rule contract: Add or update focused behavior evidence for meaningful partitions and invariants.",
  "remediation": null,
  "obligation_candidate_ids": [],
  "evidence_ids": [
    "evidence-chg-004-ambiguous"
  ],
  "target": {
    "scope": null,
    "purpose": null,
    "technique": null,
    "cadence": null,
    "failure_class": null,
    "test_path": null
  },
  "cleanup_requirements": null,
  "limitations": [
    "Emit advisory or INSUFFICIENT_EVIDENCE; never gate."
  ]
}
